{"tool_id":"webhook_send","provider_id":"webhook","capability":"send_notification","description":"POST JSON to an operator-configured webhook destination.","input_schema":{"type":"object","required":["path","body"],"properties":{"path":{"type":"string"},"body":{"type":"object"}}},"output_schema":{"type":"object","required":["result"]},"authentication":{"mode":"secret_reference","credential_reference_required":true,"scopes":["webhook.access"]},"permission_scopes":["communication.send"],"availability":"needs_configuration","risk_level":"medium","rate_limits":{"requests_per_minute":30},"estimated_cost":{"currency":"USD","per_call":0},"retry_policy":{"max_retries":0,"retryable_errors":[]},"timeout_seconds":30,"approval_required":true,"allowed_destinations":["configured_webhook"]}
