{"tool_id":"google_drive_list_files","provider_id":"google_drive","capability":"retrieve_records","description":"List files visible to the authorized Google Drive account.","input_schema":{"type":"object","properties":{"path":{"type":"string"},"query":{"type":"object"}}},"output_schema":{"type":"object","required":["result"]},"authentication":{"mode":"oauth","credential_reference_required":true,"scopes":["drive.metadata.readonly"]},"permission_scopes":["data.read"],"availability":"needs_configuration","risk_level":"low","rate_limits":{"requests_per_minute":60},"estimated_cost":{"currency":"USD","per_call":0},"retry_policy":{"max_retries":2,"retryable_errors":["timeout"]},"timeout_seconds":30,"approval_required":false}
