{"tool_id":"generic_rest_request","provider_id":"generic_rest","capability":"retrieve_records","description":"Read an operator-approved REST API endpoint.","input_schema":{"type":"object","required":["path"],"properties":{"path":{"type":"string"},"query":{"type":"object"}}},"output_schema":{"type":"object","required":["result"]},"authentication":{"mode":"api_key","credential_reference_required":true,"scopes":["http.access"]},"permission_scopes":["data.read"],"availability":"needs_configuration","risk_level":"medium","rate_limits":{"requests_per_minute":30},"estimated_cost":{"currency":"USD","per_call":0},"retry_policy":{"max_retries":1,"retryable_errors":["timeout"]},"timeout_seconds":30,"approval_required":false}
