{"tool_id":"open_library_search","provider_id":"open_library","capability":"retrieve_records","description":"Search the public Open Library API.","input_schema":{"type":"object","required":["path"],"properties":{"path":{"type":"string"},"query":{"type":"object"}}},"output_schema":{"type":"object","required":["result"]},"authentication":{"mode":"none","credential_reference_required":true,"scopes":["books.access"]},"permission_scopes":["data.read"],"availability":"needs_configuration","risk_level":"low","rate_limits":{"requests_per_minute":30},"estimated_cost":{"currency":"USD","per_call":0},"retry_policy":{"max_retries":2,"retryable_errors":["timeout"]},"timeout_seconds":30,"approval_required":false}
