{"tool_id":"github_rest_request","provider_id":"github","capability":"retrieve_records","description":"Read an approved GitHub REST endpoint.","input_schema":{"type":"object","required":["path"],"properties":{"path":{"type":"string"},"query":{"type":"object"}}},"output_schema":{"type":"object","required":["result"]},"authentication":{"mode":"api_key","credential_reference_required":true,"scopes":["github.access"]},"permission_scopes":["data.read"],"availability":"needs_configuration","risk_level":"low","rate_limits":{"requests_per_minute":60},"estimated_cost":{"currency":"USD","per_call":0},"retry_policy":{"max_retries":2,"retryable_errors":["timeout"]},"timeout_seconds":30,"approval_required":false}
