{"tool_id":"brevo_send_email","provider_id":"brevo_smtp","capability":"send_email","description":"Send email through an operator-configured Brevo SMTP relay.","input_schema":{"type":"object","required":["to","subject","body"],"properties":{"to":{"type":"string"},"subject":{"type":"string"},"body":{"type":"string"}}},"output_schema":{"type":"object","required":["message_id"]},"authentication":{"mode":"smtp","credential_reference_required":true,"scopes":["email.send"]},"permission_scopes":["communication.send"],"availability":"needs_configuration","risk_level":"high","rate_limits":{"requests_per_minute":30},"estimated_cost":{"currency":"USD","per_call":0},"retry_policy":{"max_retries":0,"retryable_errors":[]},"timeout_seconds":30,"approval_required":true,"allowed_destinations":["verified_recipients"]}
