{"tool_id":"google_calendar_list_events","provider_id":"google_calendar","capability":"retrieve_records","description":"Read events from the authorized Google Calendar.","input_schema":{"type":"object","properties":{"path":{"type":"string"},"query":{"type":"object"}}},"output_schema":{"type":"object","required":["result"]},"authentication":{"mode":"oauth","credential_reference_required":true,"scopes":["calendar.events.readonly"]},"permission_scopes":["data.read"],"availability":"needs_configuration","risk_level":"low","rate_limits":{"requests_per_minute":60},"estimated_cost":{"currency":"USD","per_call":0},"retry_policy":{"max_retries":2,"retryable_errors":["timeout"]},"timeout_seconds":30,"approval_required":false}
