{"tool_id":"slack_send_notification","provider_id":"slack","capability":"send_notification","description":"Post a notification to an operator-configured Slack incoming webhook.","input_schema":{"type":"object","required":["text"],"properties":{"text":{"type":"string","minLength":1}}},"output_schema":{"type":"object","required":["result"]},"authentication":{"mode":"secret_reference","credential_reference_required":true,"scopes":["slack.access"]},"permission_scopes":["communication.send"],"availability":"needs_configuration","risk_level":"medium","rate_limits":{"requests_per_minute":30},"estimated_cost":{"currency":"USD","per_call":0},"retry_policy":{"max_retries":0,"retryable_errors":[]},"timeout_seconds":30,"approval_required":true,"allowed_destinations":["configured_slack_webhook"]}
