{"tool_id":"open_meteo_forecast","provider_id":"open_meteo","capability":"retrieve_records","description":"Read an Open-Meteo forecast for the configured location.","input_schema":{"type":"object","required":["path"],"properties":{"path":{"type":"string"},"query":{"type":"object"}}},"output_schema":{"type":"object","required":["result"]},"authentication":{"mode":"none","credential_reference_required":true,"scopes":["weather.access"]},"permission_scopes":["data.read"],"availability":"needs_configuration","risk_level":"low","rate_limits":{"requests_per_minute":60},"estimated_cost":{"currency":"USD","per_call":0},"retry_policy":{"max_retries":2,"retryable_errors":["timeout"]},"timeout_seconds":30,"approval_required":false}
